{
  "$schema": "../../../schemas/library-quickref.schema.json",
  "version": "1.0.0",
  "generatedAt": "2026-09-03",
  "workId": "ol-rules",
  "source": {
    "name": "Department of Official Language, Ministry of Home Affairs — Official Languages Rules, 1976 (as amended 1987, 2007, 2011)",
    "url": "https://rajbhasha.gov.in/en/official-language-rules-1976"
  },
  "counts": {
    "time": 0,
    "money": 0,
    "authority": 0
  },
  "rows": []
}
